"ZLI8SFK4","journalArticle","2023","Wu, Y.; Aghamiry, H.S.; Operto, S.; Ma, J.","Helmholtz-equation solution in nonsmooth media by a physics-informed neural network incorporating quadratic terms and a perfectly matching layer condition","Geophysics","","","10.1190/GEO2022-0479.1","","Frequency-domain simulation of seismic waves plays an important role in seismic inversion, but it remains challenging in large models. The recently proposed physics-informed neural network (PINN), as an effective deep-learning method, has achieved successful applications in solving a wide range of partial differential equations (PDEs), and there is still room for improvement on this front. For example, PINN can lead to inaccurate solutions when PDE coefficients are nonsmooth and describe structurally complex media. Thus, we solve the acoustic and visco-acoustic scattered-field (Lippmann-Schwinger) wave equation in the frequency domain with PINN instead of the wave equation to remove the source singularity. We first illustrate that nonsmooth velocity models lead to inaccurate wavefields when no boundary conditions are implemented in the loss function. Then, we add the perfectly matched layer (PML) conditions in the loss function to better couple the real and imaginary parts of the wavefield. Moreover, we design new neurons by replacing the classical affine function with a quadratic function in the argument of the activation function to better capture the nonsmooth features of the wavefields. We find that the PML condition and the quadratic functions improve the results including handling attenuation and discuss the reason for this improvement. We also illustrate that a network trained to predict a wavefield for a specific medium can be used as an initial model of the neural network for predicting other wavefields corresponding to PDE-coefficient alterations and improving the convergence speed accordingly. This pretraining strategy should find applications in iterative full-waveform inversion and time-lag target-oriented imaging when the model perturbation between two consecutive iterations or two consecutive experiments is small. © 2023 Society of Exploration Geophysicists. All rights reserved.","2023","2024-08-24 16:20:11","2024-08-30 15:15:18","","T185-T202","","4","88","","","","","","","","","","","","","Scopus","","Scopus","","43 - No","","C:\Users\orincon\Zotero\storage\76L4MHJ8\display.html; C:\Users\orincon\Zotero\storage\SR3QZ2WG\Wu et al. - 2023 - Helmholtz-equation solution in nonsmooth media by .pdf","","","","","","","","","","","","","","","","","","","","","","","","","","","","","","","","","","","","","","","","","","","","","","","","",""
"S3LJZ4YB","conferencePaper","2021","Al Safwan, A.; Song, C.; Waheed, U.B.","Is it time to swish? Comparing activation functions in solving the Helmholtz equation using physics-informed neural networks","","","","","","Solving the wave equation numerically constitutes the majority of the computational cost for applications like seismic imaging and full-waveform inversion (FWI). One approach is to solve the frequency-domain Helmholtz equation which allows a reduction in dimensionality as it can be solved per frequency. However, computational challenges with the classical Helmholtz solvers such as the need to invert a large stiffness matrix can make these approaches infeasible for large 3D models or for modeling high frequencies. Moreover, these methods do not have a mechanism to transfer information gained from solving one problem to the next. This becomes a bottleneck for applications like FWI. Therefore, recently an approach based on the emerging paradigm of physics informed neural networks (PINNs) has been proposed to solve the Helmholtz equation. The method has shown promise in addressing several challenges associated with the conventional algorithms. However, the approach still needs further developments to be fully practicable. Foremost amongst the challenges is the slow convergence speed, especially in the presence of sharp heterogeneities in the velocity model. Therefore, we study different activation functions routinely used in the PINN literature, in addition to the swish activation function, which we find to yield superior performance compared to the rest. © (2021) by the European Association of Geoscientists & Engineers (EAGE)All rights reserved.","2021","2024-08-24 17:34:24","2024-08-28 21:32:45","","5438-5442","","","7","","","IS IT TIME TO SWISH?","","","","","","","","","","Scopus","","Scopus","","80 - No","","C:\Users\orincon\Zotero\storage\VFYIDBVV\Al Safwan et al. - 2021 - Is it time to swish Comparing activation function.pdf; C:\Users\orincon\Zotero\storage\NWSJ4DQX\display.html","","","","","","","","","","","","","","","","","","","","","","","","","","","","","","","","","","82nd EAGE Conference and Exhibition 2021","","","","","","","","","","","","","","",""
"KT8E6LST","preprint","2019","Hateley, James C.; Roberts, Jay; Mylonakis, Kyle; Yang, Xu","Deep Learning Seismic Substructure Detection using the Frozen Gaussian Approximation","","","","10.48550/arXiv.1810.06610","http://arxiv.org/abs/1810.06610","We propose a deep learning algorithm for seismic interface and pocket detection with neural networks trained by synthetic high-frequency displacement data efficiently generated by the frozen Gaussian approximation (FGA). In seismic imaging high-frequency data is advantageous since it can provide high resolution of substructures. However, generation of sufficient synthetic high-frequency data sets for training neural networks is computationally challenging. This bottleneck is overcome by a highly scalable computational platform built upon the FGA, which comes from the semiclassical theory and approximates the wavefields by a sum of fixed-width (frozen) Gaussian wave packets. Data is generated from a forward simulation of the elastic wave equation using the FGA. This data contains accurate traveltime information (from the ray path) but not exact amplitude information (with asymptotic errors not shrinking to zero even at extremely fine numerical resolution). Using this data we build convolutional neural network models using an open source API, GeoSeg, developed using Keras and Tensorflow. On a simple model, networks, despite only being trained on FGA data, can detect an interface with a high success rate from displacement data generated by the spectral element method. Benchmark tests are done for P-waves (acoustic) and P- and S-waves (elastic) generated using the FGA and a spectral element method. Further, results with a high accuracy are shown for more complicated geometries including a three layered model, and a 2D-pocket model where the neural networks trained by both clean and noisy data.","2019-11-05","2024-09-04 19:40:51","2024-11-27 16:05:43","2024-09-04 19:40:51","","","","","","","","","","","","arXiv","","","","","","","arXiv.org","","Cited by - 4 - Preprint - 5 - Yes - Inverse","","C:\Users\orincon\Zotero\storage\JQZW2I87\Hateley et al. - 2019 - Deep Learning Seismic Substructure Detection using.pdf; C:\Users\orincon\Zotero\storage\CWJP9XMP\1810.html","","","Physics - Geophysics","","","","","","","","","","","","","","","","","","","arXiv:1810.06610","","","","","","","","","","","","","","","","","","","","","","","","","","",""
"AYHBI7LU","preprint","2024","Alfarhan, Mustafa; Ravasi, Matteo; Chen, Fuqiang; Alkhalifah, Tariq","Robust Full Waveform Inversion with deep Hessian deblurring","","","","10.48550/arXiv.2403.17518","http://arxiv.org/abs/2403.17518","Full Waveform Inversion (FWI) is a technique widely used in geophysics to obtain high-resolution subsurface velocity models from waveform seismic data. Due to its large computation cost, most flavors of FWI rely only on the computation of the gradient of the loss function to estimate the update direction, therefore ignoring the contribution of the Hessian. Depending on the level of computational resources one can afford, an approximate of the inverse of the Hessian can be calculated and used to speed up the convergence of FWI towards the global (or a plausible local) minimum. In this work, we propose to use an approximate Hessian computed from a linearization of the wave-equation as commonly done in Least-Squares Migration (LSM). More precisely, we rely on the link between a migrated image and a doubly migrated image (i.e., an image obtained by demigration-migration of the migrated image) to estimate the inverse of the Hessian. However, instead of using non-stationary compact filters to link the two images and approximate the Hessian, we propose to use a deep neural network to directly learn the mapping between the FWI gradient (output) and its Hessian (blurred) counterpart (input). By doing so, the network learns to act as an approximate inverse Hessian: as such, when the trained network is applied to the FWI gradient, an enhanced update direction is obtained, which is shown to be beneficial for the convergence of FWI. The weights of the trained (deblurring) network are then transferred to the next FWI iteration to expedite convergence. We demonstrate the effectiveness of the proposed approach on two synthetic datasets and a field dataset.","2024-03-26","2024-09-04 19:44:37","2024-11-27 16:05:02","2024-09-04 19:44:37","","","","","","","","","","","","arXiv","","","","","","","arXiv.org","","Cited by - 0 - Preprint - 10 - Yes - Inverse","","C:\Users\orincon\Zotero\storage\GRELKJQF\Alfarhan et al. - 2024 - Robust Full Waveform Inversion with deep Hessian d.pdf; C:\Users\orincon\Zotero\storage\HAASCAUN\2403.html","","","Physics - Geophysics","","","","","","","","","","","","","","","","","","","arXiv:2403.17518","","","","","","","","","","","","","","","","","","","","","","","","","","",""
"G798RUZK","preprint","2021","Yang, Fangshu; Ma, Jianwei","Revisit Geophysical Imaging in A New View of Physics-informed Generative Adversarial Learning","","","","10.48550/arXiv.2109.11452","http://arxiv.org/abs/2109.11452","Seismic full waveform inversion (FWI) is a powerful geophysical imaging technique that produces high-resolution subsurface models by iteratively minimizing the misfit between the simulated and observed seismograms. Unfortunately, conventional FWI with least-squares function suffers from many drawbacks such as the local-minima problem and computation of explicit gradient. It is particularly challenging with the contaminated measurements or poor starting models. Recent works relying on partial differential equations and neural networks show promising performance for two-dimensional FWI. Inspired by the competitive learning of generative adversarial networks, we proposed an unsupervised learning paradigm that integrates wave equation with a discriminate network to accurately estimate the physically consistent models in a distribution sense. Our framework needs no labelled training data nor pretraining of the network, is flexible to achieve multi-parameters inversion with minimal user interaction. The proposed method faithfully recovers the well-known synthetic models that outperforms the classical algorithms. Furthermore, our work paves the way to sidestep the local-minima issue via reducing the sensitivity to initial models and noise.","2021-09-23","2024-09-04 19:47:01","2024-11-27 16:04:41","2024-09-04 19:47:01","","","","","","","","","","","","arXiv","","","","","","","arXiv.org","","Cited by - 3 - Preprint - 13 - Yes - Inverse","","C:\Users\orincon\Zotero\storage\DFMNYYLN\Yang y Ma - 2021 - Revisit Geophysical Imaging in A New View of Physi.pdf; C:\Users\orincon\Zotero\storage\YL4LKJAX\2109.html","","","Computer Science - Machine Learning; Computer Science - Computer Vision and Pattern Recognition; Electrical Engineering and Systems Science - Image and Video Processing","","","","","","","","","","","","","","","","","","","arXiv:2109.11452","","","","","","","","","","","","","","","","","","","","","","","","","","",""
"6NN3TWIF","preprint","2023","Zou, Caifeng; Azizzadenesheli, Kamyar; Ross, Zachary E.; Clayton, Robert W.","Deep Neural Helmholtz Operators for 3D Elastic Wave Propagation and Inversion","","","","10.48550/arXiv.2311.09608","http://arxiv.org/abs/2311.09608","Numerical simulations of seismic wave propagation in heterogeneous 3D media are central to investigating subsurface structures and understanding earthquake processes, yet are computationally expensive for large problems. This is particularly problematic for full waveform inversion, which typically involves numerous runs of the forward process. In machine learning there has been considerable recent work in the area of operator learning, with a new class of models called neural operators allowing for data-driven solutions to partial differential equations. Recent works in seismology have shown that when neural operators are adequately trained, they can significantly shorten the compute time for wave propagation. However, the memory required for the 3D time domain equations may be prohibitive. In this study, we show that these limitations can be overcome by solving the wave equations in the frequency domain, also known as the Helmholtz equations, since the solutions for a set of frequencies can be determined in parallel. The 3D Helmholtz neural operator is 40 times more memory-efficient than an equivalent time-domain version. We employ a U-shaped neural operator for 2D and 3D elastic wave modeling, achieving two orders of magnitude acceleration compared to a baseline spectral element method. The neural operator accurately generalizes to variable velocity structures and can be evaluated on denser input meshes than used in the training simulations. We also show that when solving for wavefields strictly on the surface, the accuracy can be significantly improved via a graph neural operator layer. In leveraging automatic differentiation, the proposed method can serve as an alternative to the adjoint-state approach for 3D full-waveform inversion, reducing the computation time by a factor of 350.","2023-11-16","2024-09-04 19:52:43","2024-11-27 16:04:26","2024-09-04 19:52:43","","","","","","","","","","","","arXiv","","","","","","","arXiv.org","","Cited by - 1 - Preprint - 21 - Yes - Inverse","","C:\Users\orincon\Zotero\storage\3ZLHGKCL\Zou et al. - 2023 - Deep Neural Helmholtz Operators for 3D Elastic Wav.pdf; C:\Users\orincon\Zotero\storage\GRW58A47\2311.html","","","Physics - Geophysics","","","","","","","","","","","","","","","","","","","arXiv:2311.09608","","","","","","","","","","","","","","","","","","","","","","","","","","",""
"YWCNSETF","conferencePaper","2021","Gao, F.; Appe, M.; Ren, L.; Williamson, P.","Multi-mode wave-equation based Scholte wave inversion","","","","10.1190/segam2021-3594533.1","","Scholte waves are interface waves propagating along fluid-solid boundaries, such as the sea bottom. They are often recorded by ocean bottom nodes (OBN)/cables (OBC) and regarded as noise in conventional data processing. In this study we present a workflow to estimate a shallow shear wave velocity model below the sea bottom by inverting Scholte waves, and demonstrate it on an OBN dataset from North Sea. We use a spectral element (SEM) seismic propagator to simulate the propagation of the Scholte waves on the irregular bathymetry, and to calculate the model updates. Technically the workflow consists of two components: dispersion curve picking using a machine learning (ML)-based method and dispersion curve inversion. The method is shown to be robust and it is believed to be a good candidate for an early stage of an elastic model building workflow when Scholte waves are observed. © 2021 Society of Exploration Geophysicists First International Meeting for Applied Geoscience & Energy","2021","2024-08-28 15:51:27","2024-11-27 16:02:52","","632-636","","","2021-September","","","","","","","","","","","","","Scopus","","Scopus","","Cited by - 2 - 106 - Yes - Inverse","","C:\Users\orincon\Zotero\storage\4FNAQZSV\display.html","","","","","","","","","","","","","","","","","","","","","","","","","","","","","","","","","","SEG Technical Program Expanded Abstracts","","","","","","","","","","","","","","",""
"WNH4P9ZQ","journalArticle","2021","Yang, Y.; Gao, A.F.; Castellanos, J.C.; Ross, Z.E.; Azizzadenesheli, K.; Clayton, R.W.","Seismic Wave Propagation and Inversion with Neural Operators","Seismic Record","","","10.1785/0320210026","","Seismic wave propagation forms the basis for most aspects of seismological research, yet solving the wave equation is a major computational burden that inhibits the progress of research. This is exacerbated by the fact that new simulations must be performed when-ever the velocity structure or source location is perturbed. Here, we explore a prototype framework for learning general solutions using a recently developed machine learning paradigm called neural operator. A trained neural operator can compute a solution in negligible time for any velocity structure or source location. We develop a scheme to train neural operators on an ensemble of simulations performed with random velocity models and source locations. As neural operators are grid free, it is possible to evaluate solutions on higher resolution velocity models than trained on, providing additional computational efficiency. We illustrate the method with the 2D acoustic wave equation and demonstrate the method’s applicability to seismic tomography, using reverse-mode automatic differentiation to compute gradients of the wavefield with respect to the velocity structure. The developed procedure is nearly an order of magnitude faster than using conventional numerical methods for full waveform inversion. © 2021. The Authors.","2021","2024-08-28 15:42:52","2024-11-27 16:02:18","","126-134","","3","1","","","","","","","","","","","","","Scopus","","Scopus","","Cited by - 34 - 100 - Yes - Inverse","","C:\Users\orincon\Zotero\storage\MMDFUKDX\display.html; C:\Users\orincon\Zotero\storage\D5RN3DU4\Yang et al. - 2021 - Seismic Wave Propagation and Inversion with Neural.pdf","","","","","","","","","","","","","","","","","","","","","","","","","","","","","","","","","","","","","","","","","","","","","","","","",""
"4FYPMUEG","journalArticle","2023","Xue, Z.; Ma, Y.; Wang, S.; Hu, H.; Li, Q.","A Multi-Task Learning Framework of Stable Q-Compensated Reverse Time Migration Based on Fractional Viscoacoustic Wave Equation","Fractal and Fractional","","","10.3390/fractalfract7120874","","Q-compensated reverse time migration (Q-RTM) is a crucial technique in seismic imaging. However, stability is a prominent concern due to the exponential increase in high-frequency ambient noise during seismic wavefield propagation. The two primary strategies for mitigating instability in Q-RTM are regularization and low-pass filtering. Q-RTM instability can be addressed through regularization. However, determining the appropriate regularization parameters is often an experimental process, leading to challenges in accurately recovering the wavefield. Another approach to control instability is low-pass filtering. Nevertheless, selecting the cutoff frequency for different Q values is a complex task. In situations with low signal-to-noise ratios (SNRs) in seismic data, using low-pass filtering can make Q-RTM highly unstable. The need for a small cutoff frequency for stability can result in a significant loss of high-frequency signals. In this study, we propose a multi-task learning (MTL) framework that leverages data-driven concepts to address the issue of amplitude attenuation in seismic records, particularly when dealing with instability during the Q-RTM (reverse time migration with Q-attenuation) process. Our innovative framework is executed using a convolutional neural network. This network has the capability to both predict and compensate for the missing high-frequency components caused by Q-effects while simultaneously reconstructing the low-frequency information present in seismograms. This approach helps mitigate overwhelming instability phenomena and enhances the overall generalization capacity of the model. Numerical examples demonstrate that our Q-RTM results closely align with the reference images, indicating the effectiveness of our proposed MTL frequency-extension method. This method effectively compensates for the attenuation of high-frequency signals and mitigates the instability issues associated with the traditional Q-RTM process. © 2023 by the authors.","2023","2024-08-24 17:44:09","2024-11-27 16:00:55","","","","12","7","","","","","","","","","","","","","Scopus","","Scopus","","Cited by - 2 - 93 - Yes - Inverse","","C:\Users\orincon\Zotero\storage\52CUKUWF\display.html; C:\Users\orincon\Zotero\storage\S37IIZR9\Xue et al. - 2023 - A Multi-Task Learning Framework of Stable Q-Compen.pdf","","","deep learning; fractional wave equation; Q-RTM","","","","","","","","","","","","","","","","","","","","","","","","","","","","","","","","","","","","","","","","","","","","","",""
"USZ2DSPJ","conferencePaper","2019","Campos, L.R.; Nogueira, P.; Moreira, D.; Nascimento, E.G.S.","An empirical analysis of the influence of seismic data modeling for estimating velocity models with fully convolutional networks","","","","","","Seismic modeling is the process of simulating wave propagations in a medium to represent underlying structures of a subsurface area of the earth. This modeling is based upon a wave equation and it depends on a set of parameters of the subsurface. Recent studies have demonstrated that deep learning methods can be trained with seismic data to estimate velocity models that give a representation of the subsurface where the seismic data was generated. Thus, an analysis is made on the impact that different sets of parameters have on the estimation of velocity models by a fully convolutional network (FCN). The experiments varied the number of sources among four options (1, 10, 25 or 50 shots) and used three different ranges of peak frequencies: 4, 8 and 16 Hz. The results demonstrated that, although the number of sources have more influence on the computational time needed to train the FCN than the peak frequency, both changes have significant impact on the quality of the estimation. The best estimations were obtained with the experiment of 25 sources with 4 Hz and increasing the peak frequency to 8 Hz improved even more the results, especially regarding the FCN's loss function. © 2019 by the International Institute of Informatics and Systemics.","2019","2024-08-24 17:43:28","2024-11-27 15:53:33","","93-98","","","1","","","","","","","","","","","","","Scopus","","Scopus","","Cited by - 0 - 92 - Yes - Inverse","","C:\Users\orincon\Zotero\storage\IXSPFKK9\Campos et al. - 2019 - An empirical analysis of the influence of seismic .pdf; C:\Users\orincon\Zotero\storage\33PPBUTQ\display.html","","","Deep Learning; Fully Convolutional Networks; Geophysics; Seismic Data Analysis; Velocity Model Estimation","","","","","","","","","","","","","","","","","","","","","","","","","","","","","","","WMSCI 2019 - 23rd World Multi-Conference on Systemics, Cybernetics and Informatics, Proceedings","","","","","","","","","","","","","","",""
"E5F27G6W","journalArticle","2023","Gelboim, M.; Adler, A.; Sun, Y.; Araya-Polo, M.","Encoder-Decoder Architecture for 3D Seismic Inversion","Sensors","","","10.3390/s23010061","","Inverting seismic data to build 3D geological structures is a challenging task due to the overwhelming amount of acquired seismic data, and the very-high computational load due to iterative numerical solutions of the wave equation, as required by industry-standard tools such as Full Waveform Inversion (FWI). For example, in an area with surface dimensions of 4.5 km × 4.5 km, hundreds of seismic shot-gather cubes are required for 3D model reconstruction, leading to Terabytes of recorded data. This paper presents a deep learning solution for the reconstruction of realistic 3D models in the presence of field noise recorded in seismic surveys. We implement and analyze a convolutional encoder–decoder architecture that efficiently processes the entire collection of hundreds of seismic shot-gather cubes. The proposed solution demonstrates that realistic 3D models can be reconstructed with a structural similarity index measure (SSIM) of 0.9143 (out of 1.0) in the presence of field noise at 10 dB signal-to-noise ratio. © 2022 by the authors.","2023","2024-08-24 17:42:38","2024-11-27 15:53:06","","","","1","23","","","","","","","","","","","","","Scopus","","Scopus","","Cited by - 7 - 91 - Yes - Inverse","","C:\Users\orincon\Zotero\storage\KDI4NMI2\display.html; C:\Users\orincon\Zotero\storage\MCJIQFRM\Gelboim et al. - 2023 - Encoder–Decoder Architecture for 3D Seismic Invers.pdf","","","deep learning; seismic inversion; 3D reconstruction; encoder–decoder; inverse problems; seismic velocity; transfer learning","","","","","","","","","","","","","","","","","","","","","","","","","","","","","","","","","","","","","","","","","","","","","",""
