"ZSBM625Z","journalArticle","2022","Chen, Y.; Saygin, E.","3-D S Wave Imaging via Robust Neural Network Interpolation of 2-D Profiles From Wave-Equation Dispersion Inversion of Seismic Ambient Noise","Journal of Geophysical Research: Solid Earth","","","10.1029/2022JB024663","","Ambient noise seismic data are widely used by geophysicists to explore subsurface properties at crustal and exploration scales. Two-step dispersion inversion schema is the dominant method used to invert the surface wave data generated by the cross-correlation of ambient noise signals. However, the two-step methods have a 1-D layered model assumption, which does not account for the complex wave propagation. To overcome this limitation, we employ a 2-D wave-equation dispersion (WD) inversion method which reconstructs the subsurface shear (S) velocity model in one step, and elastic wave-equation modeling is used to simulate the subsurface wave propagation. In the WD method, the optimal S velocity model is obtained by minimizing the dispersion curve differences between the observed and predicted surface wave data, which makes WD method less prone to getting stuck to local minima. In our study, the observed Scholte waves are generated by cross-correlating continuous ambient noise signals recorded by each ocean bottom node (OBN) in the 3-D Gorgon OBN survey, Western Australia. For every two OBN lines, the WD method is used to retrieve the 2-D S velocity structure beneath the first line. We then use a robust neural network (NN)-based method to interpolate the inverted 2-D velocity slices to a continuous 3-D velocity model and also generate a corresponding uncertainty model. Moreover, we compared the predicted dispersion curves and waveforms to the observed data, and a robust waveform and dispersion match are observed across all of the Gorgon OBN lines. © 2022 Commonwealth Scientific and Industrial Research Organisation.","2022","2024-08-24 17:12:44","2024-11-27 15:48:40","","","","12","127","","","","","","","","","","","","","Scopus","","Scopus","","Cited by - 0 - 61 - Yes - Inverse","","C:\Users\orincon\Zotero\storage\LHS2L83A\Chen y Saygin - 2022 - 3-D S Wave Imaging via Robust Neural Network Inter.pdf; C:\Users\orincon\Zotero\storage\S9L2NMJK\display.html","","","","","","","","","","","","","","","","","","","","","","","","","","","","","","","","","","","","","","","","","","","","","","","","",""
"HG9JV6CS","journalArticle","2020","Mosser, L.; Dubrule, O.; Blunt, M.J.","Stochastic Seismic Waveform Inversion Using Generative Adversarial Networks as a Geological Prior","Mathematical Geosciences","","","10.1007/s11004-019-09832-6","","We present an application of deep generative models in the context of partial differential equation constrained inverse problems. We combine a generative adversarial network representing an a priori model that generates geological heterogeneities and their petrophysical properties, with the numerical solution of the partial-differential equation governing the propagation of acoustic waves within the earth’s interior. We perform Bayesian inversion using an approximate Metropolis-adjusted Langevin algorithm to sample from the posterior distribution of earth models given seismic observations. Gradients with respect to the model parameters governing the forward problem are obtained by solving the adjoint of the acoustic wave equation. Gradients of the mismatch with respect to the latent variables are obtained by leveraging the differentiable nature of the deep neural network used to represent the generative model. We show that approximate Metropolis-adjusted Langevin sampling allows an efficient Bayesian inversion of model parameters obtained from a prior represented by a deep generative model, obtaining a diverse set of realizations that reflect the observed seismic response. © 2019, The Author(s).","2020","2024-08-24 16:39:50","2024-11-27 15:48:16","","53-79","","1","52","","","","","","","","","","","","","Scopus","","Scopus","","Cited by - 184 - 57 -Yes - Inverse","","C:\Users\orincon\Zotero\storage\CTNMMYMX\display.html; C:\Users\orincon\Zotero\storage\HDYAD7B6\Mosser et al. - 2020 - Stochastic Seismic Waveform Inversion Using Genera.pdf","","","Deep learning; Bayes; Earth modeling; Ill-posed problems","","","","","","","","","","","","","","","","","","","","","","","","","","","","","","","","","","","","","","","","","","","","","",""
"68ZQCYP3","journalArticle","2021","Auriol, J.; Kazemi, N.; Niculescu, S.-I.","Sensing and computational frameworks for improving drill-string dynamics estimation","Mechanical Systems and Signal Processing","","","10.1016/j.ymssp.2021.107836","","In this paper, we consider the axial motion of a directional multi-sectional drill-string. The drill-string dynamics are represented by a distributed dynamical model (wave equations) coupled with an ordinary differential equation at the downhole boundary (bit-rock interaction). The interaction between the drill-bit and rock can introduce severe vibrations in the drill-string and result in safety and performance issues. Consequently, the performance of drilling is interwoven with our knowledge of the subsurface. To address these problems, we propose a sensing and computational framework for estimating the drill-string dynamics and the specific intrinsic energy of the rocks while drilling. By exploiting the derived models’ particular structure, we combine the drill-string dynamics modeling with top-drive hook-load (force) and hook-speed (velocity) measurements to estimate the force-on-bit without requiring the knowledge of the sub-surface. Then, we record and model the seismic radiation patterns of drill-bit rock interactions near the surface (i.e., seismic while drilling). Such an idea allows deriving an appropriate estimation of the rocks’ intrinsic energy while drilling. We introduce two alternative rock property estimation algorithms based on direct parameter estimation and machine learning concepts to complete the analysis. The different approaches are tested and validated in simulations. We discuss their respective advantages and drawbacks. Finally, we show how to extend our methodologies in the presence of non-linear Coulomb friction terms and of coupled axial–torsional oscillations. © 2021 Elsevier Ltd","2021","2024-08-24 16:38:39","2024-11-27 15:47:49","","","","","160","","","","","","","","","","","","","Scopus","","Scopus","","Cited by - 13 - 56 - Yes - Inverse","","C:\Users\orincon\Zotero\storage\RSBE8XTN\display.html; C:\Users\orincon\Zotero\storage\VAL7X6J9\Auriol et al. - 2021 - Sensing and computational frameworks for improving.pdf","","","Backstepping; Distributed system; Dynamical system; Neural Networks; Parameter estimation; Seismic-While-Drilling","","","","","","","","","","","","","","","","","","","","","","","","","","","","","","","","","","","","","","","","","","","","","",""
"9WBHPXZQ","conferencePaper","2022","Singh, S.; Zhang, Y.; Thanoon, D.; Devarakota, P.; Jin, L.; Tsvankin, I.","Physics-directed unsupervised machine learning: Quantifying uncertainty in seismic inversion","","","","10.1190/image2022-3730701.1","","Data-driven seismic inversion techniques are often used for determination of subsurface properties. Employing the acoustic or elastic wave equation, inversion starts with approximate estimates of subsurface parameters, which are typically updated in iterative fashion. We propose a two-stage unsupervised machine-learning (ML) methodology for efficient and accurate seismic impedance inversion. The first stage utilizes the generalization capability of convolutional neural networks (CNN) to produce realistic estimates of the acoustic impedance (AI), whereas the second stage incorporates physics information to generate synthetic data from the subsurface AI distribution. We also add Bayesian layers to the first stage of the network to evaluate the model errors. The proposed probabilistic approach to deep learning allows one to estimate the uncertainty of the obtained parameters, which enhances the interpretability of the model. We apply the algorithm to a poststack data set generated using the CGG Hampson-Russell software. After conducting network training using a small number of data points, the network is applied to the rest of the data to calculate the model parameters. The developed approach has a significant advantage over more conventional ML strategies because we obtain statistically justified uncertainty maps and eliminate the need to use labeled data for training. © 2022 Society of Exploration Geophysicists and the American Association of Petroleum Geologists.","2022","2024-08-24 16:33:35","2024-11-27 15:47:31","","1735-1739","","","2022-August","","","Physics-directed unsupervised machine learning","","","","","","","","","","Scopus","","Scopus","","Cited by - 1 - 49 - Yes - Inverse","","C:\Users\orincon\Zotero\storage\QE7S7B7D\display.html","","","","","","","","","","","","","","","","","","","","","","","","","","","","","","","","","","SEG Technical Program Expanded Abstracts","","","","","","","","","","","","","","",""
"YKLMH4PR","conferencePaper","2019","Fu, H.; Zhang, Y.; Ma, M.","Seismic waveform inversion using a neural network-based forward","","","","10.1088/1742-6596/1324/1/012043","","The purpose of seismic waveform inversion is to obtain a geological model that is optimally fitted to the predicted seismic record and the measured seismic record. Since the forward model is repeatedly called during the inversion process, in order to improve efficiency, an efficient forward calculation method must be employed. In this study, we take a 2D wave equation as an example and propose a deep learning method as a forward model to minimize the prediction error value of seismic records. And the velocity inversion test of the Marmousi model is carried out by conjugate gradient method. Numerical experiments show that compared with the traditional finite difference method, the method can greatly reduce the calculation amount and improve the calculation efficiency. © 2019 IOP Publishing Ltd. All rights reserved.","2019","2024-08-24 16:29:30","2024-11-27 15:47:11","","","","","1324","","","","","","","","","","","","","Scopus","","Scopus","","Cited by - 6 - 46 - Yes - Inverse","","C:\Users\orincon\Zotero\storage\4D5Z3994\Fu et al. - 2019 - Seismic waveform inversion using a neural network-.pdf; C:\Users\orincon\Zotero\storage\AT9H5337\display.html","","","","","","","","","","","","","","","","","","","","","","","","","","","","","","","","","","Journal of Physics: Conference Series","","","","","","","","","","","","","","",""
"PLJ28Z9V","conferencePaper","2022","Dhara, A.; Sen, M.","Elastic-AdjointNet: A physics guided deep autoencoder to overcome cross talk effects in multiparameter full waveform inversion","","","","10.1190/image2022-3745050.1","","Full Waveform Inversion (FWI) is the most popular technique to obtain high resolution estimates of earth model parameters using all information present in seismic. Elastic FWI inverts multicomponent data for P and S-wave velocities and densities. We propose an alternative approach for FWI using a combination of machine learning and the physics of wave propagation. Unlike a conventional supervised machine learning, we do not require known answers to train our network. The multicomponent shot gathers are input to a convolutional neural network (CNNs) based auto encoder whose outputs are used as P-wave, S-wave and density models that are used to compute synthetic seismograms using the stress-velocity formulation of the elastic wave equation. The synthetic data are compared against observed input data and the misfit is estimated. The gradient of the misfit with respect to the velocity model parameters is calculated using the adjoint state method. The adjoint state gradient is then used to update the network weights using the automatic differentiation technique. Once the misfit term converges, the neural network can generate subsurface models consistent with the observed data. We observe that the neural network can capture spatial correlations at different scales and thus can introduce regularization in our inverse problem. The regularization is enough to mitigate the cross-talk problem in elastic FWI and also produce good results in areas with low illumination. © 2022 Society of Exploration Geophysicists and the American Association of Petroleum Geologists.","2022","2024-08-24 16:22:44","2024-11-27 15:46:51","","882-886","","","2022-August","","","Elastic-AdjointNet","","","","","","","","","","Scopus","","Scopus","","Cited by - 8 - 45 - Yes - Inverse","","C:\Users\orincon\Zotero\storage\LNCN8KUD\Dhara y Sen - 2022 - Elastic-AdjointNet A physics guided deep autoenco.pdf; C:\Users\orincon\Zotero\storage\RTVJQK6I\display.html","","","","","","","","","","","","","","","","","","","","","","","","","","","","","","","","","","SEG Technical Program Expanded Abstracts","","","","","","","","","","","","","","",""
"D5AXNEQ4","journalArticle","2023","Wang, S.; Jiang, Y.; Song, P.; Tan, J.; Liu, Z.; He, B.","Memory Optimization in RNN-Based Full Waveform Inversion Using Boundary Saving Wavefield Reconstruction","IEEE Transactions on Geoscience and Remote Sensing","","","10.1109/TGRS.2023.3317529","","In wave equation modeling, wavefields propagating over time can be regarded as feedforward in a recurrent neural network (RNN). Therefore, the seismic inversion problem based on partial differential wave equations can be addressed using automatic differentiation in the state-of-the-art deep learning frameworks, eliminating the need for explicit backpropagating the residual wavefield. However, one challenge that arises in the context of automatic differentiation is the significant memory usage due to the necessity of storing the hidden states of the RNN (i.e., wavefields in seismic modeling) during forward computation for constructing the computational graph and computing the derivatives during backpropagation. This memory overhead can become a bottleneck, particularly when dealing with large-scale inversion problems. To mitigate this issue, we propose an effective boundary-saving strategy that allows for the reconstruction of the computational graph during the backpropagation process. Instead of storing all the intermediate wavefields at each time step, we selectively save the necessary information at the boundaries, thereby significantly reducing the memory footprint. This approach enables us to maintain the convenience and efficiency of automatic differentiation computations while minimizing the memory requirements. Both 2-D and 3-D numerical experiments validate the accurate reconstruction of wavefields with minimal loss in precision, while the computational graph is simultaneously reconstructed. Consequently, the gradients can also be calculated correctly by automatic differentiation with minimal CPU/graphics processing unit (GPU) memory occupation. © 1980-2012 IEEE.","2023","2024-08-24 16:15:49","2024-11-27 15:46:06","","","","","61","","","","","","","","","","","","","Scopus","","Scopus","","Cited by - 2 - 39 - Yes - Inverse","","C:\Users\orincon\Zotero\storage\I8TEJAKQ\display.html; C:\Users\orincon\Zotero\storage\G3TJ8JSJ\Wang et al. - 2023 - Memory Optimization in RNN-Based Full Waveform Inv.pdf","","","Automatic differentiation; boundary saving; full waveform inversion","","","","","","","","","","","","","","","","","","","","","","","","","","","","","","","","","","","","","","","","","","","","","",""
"IAWSHXXA","bookSection","2022","Huang, L.; Clee, E.; Ranasinghe, N.","Applying scientific machine learning to improve seismic wave simulation and inversion","Advances in Subsurface Data Analytics: Traditional and Physics-Based Machine Learning","","","","","Accurate simulation of wave motion for the modeling and inversion of seismic wave propagation is a classical high-performance computing (HPC) application using the finite difference, finite element, and spectral element methods to solve the wave equation numerically. The article presents a new method to improve the performance of seismic wave simulation and inversion by integrating the deep learning software platform and deep learning models with the HPC application. The paper has three contributions: (1) instead of using traditional HPC software, the authors implement the numerical solutions for the wave equation employing recently developed tensor processing capabilities widely used in the deep learning software platform of PyTorch. By using PyTorch, the classical HPC application is reformulated as a deep learning recurrent neural network framework; (2) the authors customize the automatic differentiation of PyTorch to integrate the adjoint state method for an efficient gradient calculation; (3) the authors build a deep learning model to reduce the physical model dimensions to improve the accuracy and performance of seismic inversion. The automatic differentiation functionality and a variety of optimizers provided by PyTorch are used to enhance the performance of the classical HPC application. Additionally, methods developed in the paper can be extended into other physics-based scientific computing applications, such as computational fluid dynamics, medical imaging, nondestructive testing, as well as the propagation of electromagnetic waves in the earth. © 2022 Elsevier Inc. All rights reserved.","2022","2024-08-24 16:11:07","2024-11-27 15:45:47","","167-192","","","","","","","","","","","","","","","","Scopus","","Scopus","","Cited by - 0 - 37 - Yes - Inverse","","C:\Users\orincon\Zotero\storage\25ENGMMF\Huang et al. - 2022 - Applying scientific machine learning to improve se.pdf; C:\Users\orincon\Zotero\storage\WKGJNKKV\display.html","","","Scientific machine learning; Inverse problem; Seismic imaging; Seismic wave propagation","","","","","","","","","","","","","","","","","","","","","","","","","","","","","","","","","","","","","","","","","","","","","",""
"MHPCN5LE","journalArticle","2023","Yu, Y.; Li, Y.; Wu, X.; Jia, X.","Enhancing one-way wave equation-based migration with deep learning","Geophysics","","","10.1190/geo2022-0159.1","","One advantage of one-way wave equation-based migration is its low computational cost. However, due to the limited wavefield propagation angle, it is difficult to use one-way wave equation-based migration for high-precision imaging of structures with large inclinations due to issues such as inaccurate amplitudes and migration image artifacts. In addition, when the model has large horizontal velocity differences, it is difficult for the one-way wave propagator to calculate an accurate wavefield phase. Reverse time migration (RTM) based on the two-way wave propagator has a high resolution and avoids the issues associated with one-way wave propagators; however, it has a high computational cost in practical applications. We develop a convolutional neural network (CNN) application mode that improves one migration method by learning from another one and design a CNN with a structure similar to U-net that combines the advantages of both migration methods. The CNN label is the RTM result, and the corresponding input is the result of one-way wave migration with a generalized screen propagator (GSP). The trained CNN model improves the amplitude in the one-way wave migration image and removes the errors caused by large lateral velocity perturbations. Moreover, by maintaining the high migration calculation efficiency, our CNN model allows for a high resolution, few artifacts, and accurate images of steep structures in the one-way wave migration result. With our method, the accuracy of the one-way wave migration result is close to that of the RTM result. The use of GSP-based migration in our CNN model rather than conventional RTM to generate prospecting images can considerably reduce the calculation costs. © 2023 Society of Exploration Geophysicists.","2023","2024-08-24 16:07:36","2024-11-27 15:45:23","","WA105-WA114","","1","88","","","","","","","","","","","","","Scopus","","Scopus","","Cited by - 2 - 34 - Yes - Inverse","","C:\Users\orincon\Zotero\storage\55MBFY4G\display.html; C:\Users\orincon\Zotero\storage\CU2CLGWQ\Yu et al. - 2023 - Enhancing one-way wave equation-based migration wi.pdf","","","machine learning; high resolution; migration; one way; reverse time migration","","","","","","","","","","","","","","","","","","","","","","","","","","","","","","","","","","","","","","","","","","","","","",""
"IQ8NCD2H","journalArticle","2023","Lu, C.; Zhang, C.","Seismic Velocity Inversion via Physical Embedding Recurrent Neural Networks (RNN)","Applied Sciences (Switzerland)","","","10.3390/app132413312","","Seismic velocity inversion is one of the most critical issues in the field of seismic exploration and has long been the focus of numerous experts and scholars. In recent years, the advancement of machine learning technologies has infused new vitality into the research of seismic velocity inversion and yielded a wealth of research outcomes. Typically, seismic velocity inversion based on machine learning lacks control over physical processes and interpretability. Starting from wave theory and the physical processes of seismic data acquisition, this paper proposes a method for seismic velocity model inversion based on Physical Embedding Recurrent Neural Networks. Firstly, the wave equation is a mathematical representation of the physical process of acoustic waves propagating through a medium, and the finite difference method is an effective approach to solving the wave equation. With this in mind, we introduce the architecture of recurrent neural networks to describe the finite difference solution of the wave equation, realizing the embedding of physical processes into machine learning. Secondly, in seismic data acquisition, the propagation of acoustic waves from multiple sources through the medium represents a high-dimensional causal time series (wavefield snapshots), where the influential variable is the velocity model, and the received signals are the observations of the wavefield. This forms a forward modeling process as the forward simulation of the wavefield equation, and the use of error back-propagation between observations and calculations as the velocity inversion process. Through time-lapse inversion and by incorporating the causal information of wavefield propagation, the non-uniqueness issue in velocity inversion is mitigated. Through mathematical derivations and theoretical model analyses, the effectiveness and rationality of the method are demonstrated. In conjunction with simulation results for complex models, the method proposed in this paper can achieve velocity inversion in complex geological structures. © 2023 by the authors.","2023","2024-08-24 16:01:33","2024-11-27 15:45:02","","","","24","13","","","","","","","","","","","","","Scopus","","Scopus","","Cited by - 2 - 29 - Yes - Inverse","","C:\Users\orincon\Zotero\storage\NU93K4BT\display.html; C:\Users\orincon\Zotero\storage\42JME73W\Lu y Zhang - 2023 - Seismic Velocity Inversion via Physical Embedding .pdf","","","seismic waveform inversion; causal sequence; physical information neural network; velocity modeling","","","","","","","","","","","","","","","","","","","","","","","","","","","","","","","","","","","","","","","","","","","","","",""
"FMC59VW4","journalArticle","2020","Karimpouli, Sadegh; Tahmasebi, Pejman","Physics informed machine learning: Seismic wave equation","Geoscience Frontiers","","1674-9871","10.1016/j.gsf.2020.07.007","https://www.sciencedirect.com/science/article/pii/S1674987120301717","Similar to many fields of sciences, recent deep learning advances have been applied extensively in geosciences for both small- and large-scale problems. However, the necessity of using large training data and the ‘black box’ nature of learning have limited them in practice and difficult to interpret. Furthermore, including the governing equations and physical facts in such methods is also another challenge, which entails either ignoring the physics or simplifying them using unrealistic data. To address such issues, physics informed machine learning methods have been developed which can integrate the governing physics law into the learning process. In this work, a 1-dimensional (1D) time-dependent seismic wave equation is considered and solved using two methods, namely Gaussian process (GP) and physics informed neural networks. We show that these meshless methods are trained by smaller amount of data and can predict the solution of the equation with even high accuracy. They are also capable of inverting any parameter involved in the governing equation such as wave velocity in our case. Results show that the GP can predict the solution of the seismic wave equation with a lower level of error, while our developed neural network is more accurate for velocity (P- and S-wave) and density inversion.","2020-11-01","2024-02-01 23:38:43","2024-11-27 15:44:35","2024-02-01 23:38:43","1993-2001","","6","11","","Geoscience Frontiers","Physics informed machine learning","","","","","","","","","","","","ScienceDirect","","Cited by - 108 - 25 - Yes - Inverse","","C:\Users\orincon\Zotero\storage\TLCZRAWN\Karimpouli and Tahmasebi - 2020 - Physics informed machine learning Seismic wave eq.pdf; C:\Users\orincon\Zotero\storage\PL8KJIBX\S1674987120301717.html; C:\Users\orincon\Zotero\storage\L8R35MEI\S1674987120301717.html; C:\Users\orincon\Zotero\storage\MS77RZSL\display.html","","Gaussian process (GP); Optimization; Physics informed machine learning (PIML); Seismic wave","","","","","","","","","","","","","","","","","","","","","","","","","","","","","","","","","","","","","","","","","","","","","","",""
