"5YJH9RDJ","preprint","2023","Li, Bian; Wang, Hanchen; Feng, Shihang; Yang, Xiu; Lin, Youzuo","Solving Seismic Wave Equations on Variable Velocity Models With Fourier Neural Operator","","","","10.48550/arXiv.2209.12340","http://arxiv.org/abs/2209.12340","In the study of subsurface seismic imaging, solving the acoustic wave equation is a pivotal component in existing models. The advancement of deep learning enables solving partial differential equations, including wave equations, by applying neural networks to identify the mapping between the inputs and the solution. This approach can be faster than traditional numerical methods when numerous instances are to be solved. Previous works that concentrate on solving the wave equation by neural networks consider either a single velocity model or multiple simple velocity models, which is restricted in practice. Instead, inspired by the idea of operator learning, this work leverages the Fourier neural operator (FNO) to effectively learn the frequency domain seismic wavefields under the context of variable velocity models. We also propose a new framework paralleled Fourier neural operator (PFNO) for efficiently training the FNO-based solver given multiple source locations and frequencies. Numerical experiments demonstrate the high accuracy of both FNO and PFNO with complicated velocity models in the OpenFWI datasets. Furthermore, the cross-dataset generalization test verifies that PFNO adapts to out-of-distribution velocity models. Moreover, PFNO has robust performance in the presence of random noise in the labels. Finally, PFNO admits higher computational efficiency on large-scale testing datasets than the traditional finite-difference method. The aforementioned advantages endow the FNO-based solver with the potential to build powerful models for research on seismic waves.","2023-02-19","2024-09-04 19:15:27","2024-09-04 20:18:37","2024-09-04 19:15:27","","","","","","","","","","","","arXiv","","","","","","","arXiv.org","","Preprint - 3 - duplicated","","C:\Users\orincon\Zotero\storage\8SSHWVYM\Li et al. - 2023 - Solving Seismic Wave Equations on Variable Velocit.pdf; C:\Users\orincon\Zotero\storage\Q5B7EBFX\2209.html","","","Computer Science - Machine Learning; Physics - Geophysics; 68T07 (Primary) 86-08 (Secondary)","","","","","","","","","","","","","","","","","","","arXiv:2209.12340","","","","","","","","","","","","","","","","","","","","","","","","","","",""
"Z227TXM5","preprint","2021","Yang, Yan; Gao, Angela F.; Castellanos, Jorge C.; Ross, Zachary E.; Azizzadenesheli, Kamyar; Clayton, Robert W.","Seismic Wave Propagation and Inversion with Neural Operators","","","","10.48550/arXiv.2108.05421","http://arxiv.org/abs/2108.05421","Seismic wave propagation forms the basis for most aspects of seismological research, yet solving the wave equation is a major computational burden that inhibits the progress of research. This is exacerbated by the fact that new simulations must be performed when the velocity structure or source location is perturbed. Here, we explore a prototype framework for learning general solutions using a recently developed machine learning paradigm called Neural Operator. A trained Neural Operator can compute a solution in negligible time for any velocity structure or source location. We develop a scheme to train Neural Operators on an ensemble of simulations performed with random velocity models and source locations. As Neural Operators are grid-free, it is possible to evaluate solutions on higher resolution velocity models than trained on, providing additional computational efficiency. We illustrate the method with the 2D acoustic wave equation and demonstrate the method's applicability to seismic tomography, using reverse mode automatic differentiation to compute gradients of the wavefield with respect to the velocity structure. The developed procedure is nearly an order of magnitude faster than using conventional numerical methods for full waveform inversion.","2021-10-13","2024-09-04 19:47:34","2024-09-04 20:18:12","2024-09-04 19:47:34","","","","","","","","","","","","arXiv","","","","","","","arXiv.org","","Preprint - 14 - duplicated","","C:\Users\orincon\Zotero\storage\LHMDXJDK\Yang et al. - 2021 - Seismic wave propagation and inversion with Neural.pdf; C:\Users\orincon\Zotero\storage\T9843ZMY\2108.html","","","Computer Science - Machine Learning; Physics - Geophysics","","","","","","","","","","","","","","","","","","","arXiv:2108.05421","","","","","","","","","","","","","","","","","","","","","","","","","","",""
"TVL4WVKZ","preprint","2021","Chen, Yuqing; Saygin, Erdinc","Seismic inversion by multi-dimensional newtonian machine learning","","","","10.48550/arXiv.2112.08629","http://arxiv.org/abs/2112.08629","Newtonian machine learning (NML) is a wave-equation inversion method that inverts single-dimensional latent space (LS) features of the seismic data for retrieving the subsurface background velocity model. The single-dimensional LS features mainly contain the kinematic information of the seismic data, which are automatically extracted from the seismic signal by using an autoencoder network. Because its LS feature dimension is too small to preserve the dynamic information, such as the waveform variations, of the seismic data. Therefore the NML inversion is not able to recover the high-wavenumber velocity details. To mitigate this problem, we propose to invert multi-dimensional LS features, which can fully represent the entire characters of the seismic data. We denote this method as multi-dimensional Newtonian machine learning (MNML). In MNML, we define a new multi-variable connective function that works together with the multi-variable implicit function theorem to connect the velocity perturbations to the multi-dimensional LS feature perturbations. Numerical tests show that (1) the multi-dimensional LS features can preserve more data information than the single-dimensional LS features; (2) a higher resolution velocity model can be recovered by inverting the multi-dimensional LS features, and the inversion quality is comparable to that of FWI; (3) the MNML method requires a much smaller storage space than conventional FWI because only the low-dimensional representations of the high-dimensional seismic data are needed to be stored. The disadvantage of MNML is that it can more easily get stuck in local minima compared to the NML method. So we suggest a multiscale inversion approach that inverts for higher dimensional LS features as the iteration count increase.","2021-12-16","2024-09-04 19:55:52","2024-09-04 20:17:21","2024-09-04 19:55:52","","","","","","","","","","","","arXiv","","","","","","","arXiv.org","","Preprint - 24 - duplicated","","C:\Users\orincon\Zotero\storage\9DLSX4TM\Chen y Saygin - 2021 - Seismic Inversion by Multi-dimensional Newtonian M.pdf; C:\Users\orincon\Zotero\storage\FRN9XKHU\2112.html","","","Physics - Geophysics","","","","","","","","","","","","","","","","","","","arXiv:2112.08629","","","","","","","","","","","","","","","","","","","","","","","","","","",""
"C5G3ACKA","preprint","2023","Yang, Yan; Gao, Angela F.; Azizzadenesheli, Kamyar; Clayton, Robert W.; Ross, Zachary E.","Rapid Seismic Waveform Modeling and Inversion With Neural Operators","","","","10.1109/TGRS.2023.3264210","http://arxiv.org/abs/2209.11955","Seismic waveform modeling is a powerful tool for determining earth structure models and unraveling earthquake rupture processes, but it is usually computationally expensive. We introduce a scheme to vastly accelerate these calculations with a recently developed machine learning paradigm called the neural operator. Once trained, these models can simulate a full wavefield at negligible cost. We use a U-shaped neural operator to learn a general solution operator to the 2D elastic wave equation from an ensemble of numerical simulations performed with random velocity models and source locations. We show that full waveform modeling with neural operators is nearly two orders of magnitude faster than conventional numerical methods, and more importantly, the trained model enables accurate simulation for velocity models, source locations, and mesh discretization distinctly different from the training dataset. The method also enables convenient full-waveform inversion with automatic differentiation.","2023","2024-09-04 19:48:07","2024-09-04 20:16:35","2024-09-04 19:48:07","","","","","","","","","","","","","","","","","","","arXiv.org","","Preprint - 15 - duplicated","","C:\Users\orincon\Zotero\storage\ZTV58XY8\Yang et al. - 2023 - Rapid Seismic Waveform Modeling and Inversion with.pdf; C:\Users\orincon\Zotero\storage\EEDTSJRZ\2209.html","","","Physics - Geophysics","","","","","","","","","","","","","","","","","","","","","","","","","","","","","","","","","","","","","","","","","","","","","",""
"7DW3XKLB","preprint","2023","Brandolin, Francesco; Ravasi, Matteo; Alkhalifah, Tariq","PINNslope: Seismic data interpolation and local slope estimation with physics informed neural networks","","","","10.48550/arXiv.2305.15990","http://arxiv.org/abs/2305.15990","Interpolation of aliased seismic data constitutes a key step in a seismic processing workflow to obtain high quality velocity models and seismic images. Building on the idea of describing seismic wavefields as a superposition of local plane waves, we propose to interpolate seismic data by utilizing a physics informed neural network (PINN). In the proposed framework, two feed-forward neural networks are jointly trained using the local plane wave differential equation as well as the available data as two terms in the objective function: a primary network assisted by positional encoding is tasked with reconstructing the seismic data, whilst an auxiliary, smaller network estimates the associated local slopes. Results on synthetic and field data validate the effectiveness of the proposed method in handling aliased (coarsely sampled) data and data with large gaps. Our method compares favorably against a classic least-squares inversion approach regularized by the local plane-wave equation as well as a PINN-based approach with a single network and pre-computed local slopes. We find that introducing a second network to estimate the local slopes whilst at the same time interpolating the aliased data enhances the overall reconstruction capabilities and convergence behavior of the primary network. Moreover, an additional positional encoding layer embedded as the first layer of the wavefield network confers to the network the ability to converge faster improving the accuracy of the data term.","2023-12-09","2024-09-04 19:43:56","2024-09-04 20:16:15","2024-09-04 19:43:56","","","","","","","PINNslope","","","","","arXiv","","","","","","","arXiv.org","","Preprint - 9 - duplicated","","C:\Users\orincon\Zotero\storage\Y62HTNIW\Brandolin et al. - 2023 - PINNslope seismic data interpolation and local sl.pdf; C:\Users\orincon\Zotero\storage\QLRTU3AN\2305.html","","","Computer Science - Machine Learning; Physics - Geophysics; Electrical Engineering and Systems Science - Signal Processing","","","","","","","","","","","","","","","","","","","arXiv:2305.15990","","","","","","","","","","","","","","","","","","","","","","","","","","",""
"9VWMHSMP","journalArticle","2021","Mancini, A. Spurio; Piras, D.; Ferreira, A. M. G.; Hobson, M. P.; Joachimi, B.","Accelerating Bayesian microseismic event location with deep learning","Solid Earth","","1869-9529","10.5194/se-12-1683-2021","http://arxiv.org/abs/2009.06758","We present a series of new open source deep learning algorithms to accelerate Bayesian full waveform point source inversion of microseismic events. Inferring the joint posterior probability distribution of moment tensor components and source location is key for rigorous uncertainty quantification. However, the inference process requires forward modelling of microseismic traces for each set of parameters explored by the sampling algorithm, which makes the inference very computationally intensive. In this paper we focus on accelerating this process by training deep learning models to learn the mapping between source location and seismic traces, for a given 3D heterogeneous velocity model, and a fixed isotropic moment tensor for the sources. These trained emulators replace the expensive solution of the elastic wave equation in the inference process. We compare our results with a previous study that used emulators based on Gaussian Processes to invert microseismic events. We show that all of our models provide more accurate predictions and $\sim 100$ times faster predictions than the method based on Gaussian Processes, and a $\mathcal{O}(10^5)$ speed-up factor over a pseudo-spectral method for waveform generation. For example, a 2-s long synthetic trace can be generated in $\sim 10$ ms on a common laptop processor, instead of $\sim$ 1 hr using a pseudo-spectral method on a high-profile Graphics Processing Units card. We also show that our inference results are in excellent agreement with those obtained from traditional location methods based on travel time estimates. The speed, accuracy and scalability of our open source deep learning models pave the way for extensions of these emulators to generic source mechanisms and application to joint Bayesian inversion of moment tensor components and source location using full waveforms.","2021-07-29","2024-09-04 19:56:21","2024-09-04 20:11:25","2024-09-04 19:56:21","1683-1705","","7","12","","Solid Earth","","","","","","","","","","","","","arXiv.org","","Preprint - 25 - duplicated","","C:\Users\orincon\Zotero\storage\S8N2TK25\Mancini et al. - 2021 - Accelerating Bayesian microseismic event location .pdf; C:\Users\orincon\Zotero\storage\9PQMTMXX\2009.html","","","Physics - Computational Physics; Physics - Geophysics; Physics - Data Analysis, Statistics and Probability","","","","","","","","","","","","","","","","","","","","","","","","","","","","","","","","","","","","","","","","","","","","","",""
"9NYSZW2I","journalArticle","2021","Chen, Yuqing; Saygin, Erdinc","Seismic Inversion by Hybrid Machine Learning","Journal of Geophysical Research: Solid Earth","","2169-9313, 2169-9356","10.1029/2020JB021589","http://arxiv.org/abs/2009.06846","We present a new seismic inversion method that uses deep learning (DL) features for the subsurface velocity model estimation. The DL feature is a low-dimensional representation of the high-dimensional seismic data, which is automatically generated by a convolutional autoencoder (CAE) and preserved in the latent space. The low-dimensional DL feature contains the key information of the input seismic data. Therefore, instead of directly comparing the waveform differences between the observed and predicted data, such as full-waveform inversion (FWI). We measure their DL feature differences in the latent space of a CAE. The advantage of this low-dimensional comparison is that it is less prone to the cycle-skipping problem compared to FWI. The reason is that the DL features mainly contain the kinematic information, such as traveltime, of the input seismic data when the latent space dimension is small. However, more dynamic information, such as the waveform variations, can be preserved in the DL feature when the latent space dimension becomes larger. Therefore we propose a multiscale inversion approach that starts with inverting the low-dimensional DL features for the low-wavenumber information of the subsurface model. Then recover its high-wavenumber details through inverting the high-dimensional DL features. However, there is no governing equation that contains both the velocity and DL feature terms in the same equation. Therefore we use the automatic differentiation (AD) to numerically connect the perturbation of DL features to the velocity perturbation. In another word, we connect a deep learning network with the wave-equation inversion by using the AD. We denote this hybrid connection as hybrid machine learning (HML) inversion. Here, the AD replaces the complex math derivations of the gradient with a black box so anyone can do HML without having a deep geophysical background.","2021-09","2024-09-04 19:52:10","2024-09-04 20:08:35","2024-09-04 19:52:10","e2020JB021589","","9","126","","JGR Solid Earth","","","","","","","","","","","","","arXiv.org","","Preprint - 20 - duplicated","","C:\Users\orincon\Zotero\storage\MNBE3N6P\Chen y Saygin - 2021 - Seismic Inversion by Hybrid Machine Learning.pdf; C:\Users\orincon\Zotero\storage\F3V2AA9E\2009.html","","","Physics - Geophysics","","","","","","","","","","","","","","","","","","","","","","","","","","","","","","","","","","","","","","","","","","","","","",""
"XYAT6H3Q","preprint","2022","Gelboim, Maayan; Adler, Amir; Sun, Yen; Araya-Polo, Mauricio","Encoder-Decoder Architecture for 3D Seismic Inversion","","","","10.48550/arXiv.2207.14789","http://arxiv.org/abs/2207.14789","Inverting seismic data to build 3D geological structures is a challenging task due to the overwhelming amount of acquired seismic data, and the very-high computational load due to iterative numerical solutions of the wave equation, as required by industry-standard tools such as Full Waveform Inversion (FWI). For example, in an area with surface dimensions of 4.5km $\times$ 4.5km, hundreds of seismic shot-gather cubes are required for 3D model reconstruction, leading to Terabytes of recorded data. This paper presents a deep learning solution for the reconstruction of realistic 3D models in the presence of field noise recorded in seismic surveys. We implement and analyze a convolutional encoder-decoder architecture that efficiently processes the entire collection of hundreds of seismic shot-gather cubes. The proposed solution demonstrates that realistic 3D models can be reconstructed with a structural similarity index measure (SSIM) of 0.8554 (out of 1.0) in the presence of field noise at 10dB signal-to-noise ratio.","2022-07-29","2024-09-04 19:51:39","2024-09-04 20:08:04","2024-09-04 19:51:39","","","","","","","","","","","","arXiv","","","","","","","arXiv.org","","Preprint - 19 - duplicated","","C:\Users\orincon\Zotero\storage\UABX6743\Gelboim et al. - 2022 - Encoder-Decoder Architecture for 3D Seismic Invers.pdf; C:\Users\orincon\Zotero\storage\FVWQ9QEI\2207.html","","","Computer Science - Machine Learning; Physics - Geophysics; Electrical Engineering and Systems Science - Signal Processing","","","","","","","","","","","","","","","","","","","arXiv:2207.14789","","","","","","","","","","","","","","","","","","","","","","","","","","",""
"V7XJ3W2E","preprint","2020","Freitas, Rodolfo S. M.; Barbosa, Carlos H. S.; Guerra, Gabriel M.; Coutinho, Alvaro L. G. A.; Rochinha, Fernando A.","An encoder-decoder deep surrogate for reverse time migration in seismic imaging under uncertainty","","","","","https://arxiv.org/abs/2006.09550v1","Seismic imaging faces challenges due to the presence of several uncertainty sources. Uncertainties exist in data measurements, source positioning, and subsurface geophysical properties. Reverse time migration (RTM) is a high-resolution depth migration approach useful for extracting information such as reservoir localization and boundaries. RTM, however, is time-consuming and data-intensive as it requires computing twice the wave equation to generate and store an imaging condition. RTM, when embedded in an uncertainty quantification algorithm (like the Monte Carlo method), shows a many-fold increase in its computational complexity due to the high input-output dimensionality. In this work, we propose an encoder-decoder deep learning surrogate model for RTM under uncertainty. Inputs are an ensemble of velocity fields, expressing the uncertainty, and outputs the seismic images. We show by numerical experimentation that the surrogate model can reproduce the seismic images accurately, and, more importantly, the uncertainty propagation from the input velocity fields to the image ensemble.","2020-06-16","2024-09-04 19:50:13","2024-09-04 20:07:10","2024-09-04 19:50:13","","","","","","","","","","","","","","en","","","","","","","Preprint - 17 - duplicated","","C:\Users\orincon\Zotero\storage\T53K2UMK\Freitas et al. - 2020 - An encoder-decoder deep surrogate for reverse time.pdf","","","","","","","","","","","","","","","","","","","","","","","","","","","","","","","","","","","","","","","","","","","","","","","","",""
"TBCE4NBE","preprint","2023","Louboutin, Mathias; Yin, Ziyi; Orozco, Rafael; Grady II, Thomas J.; Siahkoohi, Ali; Rizzuti, Gabrio; Witte, Philipp A.; Møyner, Olav; Gorman, Gerard J.; Herrmann, Felix J.","Learned multiphysics inversion with differentiable programming and machine learning","","","","","https://arxiv.org/abs/2304.05592v1","We present the Seismic Laboratory for Imaging and Modeling/Monitoring (SLIM) open-source software framework for computational geophysics and, more generally, inverse problems involving the wave-equation (e.g., seismic and medical ultrasound), regularization with learned priors, and learned neural surrogates for multiphase flow simulations. By integrating multiple layers of abstraction, our software is designed to be both readable and scalable. This allows researchers to easily formulate their problems in an abstract fashion while exploiting the latest developments in high-performance computing. We illustrate and demonstrate our design principles and their benefits by means of building a scalable prototype for permeability inversion from time-lapse crosswell seismic data, which aside from coupling of wave physics and multiphase flow, involves machine learning.","2023-04-12","2024-09-04 19:49:02","2024-09-04 20:06:43","2024-09-04 19:49:02","","","","","","","","","","","","","","en","","","","","","","Preprint - 16 - duplicated","","C:\Users\orincon\Zotero\storage\EPYGVET3\Louboutin et al. - 2023 - Learned multiphysics inversion with differentiable.pdf","","","","","","","","","","","","","","","","","","","","","","","","","","","","","","","","","","","","","","","","","","","","","","","","",""
"NYRG9IDY","preprint","2021","Al-Safwan, Ali; Song, Chao; Waheed, Umair bin","Is it time to swish? Comparing activation functions in solving the Helmholtz equation using physics-informed neural networks","","","","10.48550/arXiv.2110.07721","http://arxiv.org/abs/2110.07721","Solving the wave equation numerically constitutes the majority of the computational cost for applications like seismic imaging and full waveform inversion. An alternative approach is to solve the frequency domain Helmholtz equation, since it offers a reduction in dimensionality as it can be solved per frequency. However, computational challenges with the classical Helmholtz solvers such as the need to invert a large stiffness matrix can make these approaches computationally infeasible for large 3D models or for modeling high frequencies. Moreover, these methods do not have a mechanism to transfer information gained from solving one problem to the next. This becomes a bottleneck for applications like full waveform inversion where repeated modeling is necessary. Therefore, recently a new approach based on the emerging paradigm of physics informed neural networks (PINNs) has been proposed to solve the Helmholtz equation. The method has shown promise in addressing several challenging associated with the conventional algorithms, including flexibility to model additional physics and the use of transfer learning to speed up computations. However, the approach still needs further developments to be fully practicable. Foremost amongst the challenges is the slow convergence speed and reduced accuracy, especially in presence of sharp heterogeneities in the velocity model. Therefore, with an eye on exploring how improved convergence can be obtained for the PINN Helmholtz solvers, we study different activation functions routinely used in the PINN literature, in addition to the swish activation function - a variant of ReLU that has shown improved performance on a number of data science problems. Through a comparative study, we find that swish yields superior performance compared to the other activation functions routinely used in the PINN literature.","2021-10-11","2024-09-04 19:46:17","2024-09-04 20:04:17","2024-09-04 19:46:17","","","","","","","Is it time to swish?","","","","","arXiv","","","","","","","arXiv.org","","Preprint - 12 - duplicated","","C:\Users\orincon\Zotero\storage\KXDW85H5\Al-Safwan et al. - 2021 - Is it time to swish Comparing activation function.pdf; C:\Users\orincon\Zotero\storage\BTBCRR46\2110.html","","","Physics - Computational Physics; Physics - Geophysics","","","","","","","","","","","","","","","","","","","arXiv:2110.07721","","","","","","","","","","","","","","","","","","","","","","","","","","",""
